Date,Band,Notable Support,Venue,Price,Comments,Went With,Festival?,Festival Lineups,Photos,Journal Key,OfficialVenue,Year,Month,Day
28/08/1997,V97,,Hylands Park,£50.00,First festival,Meds / Rob / Stem / Kate / Rich,Y,Stereophonics / Radish / Blur / Prodigy,,28/08/1997Hylands Park,Hylands Park,1997,8,28
29/09/1997,Fountains of Wayne,,LA2,£7.50,"Met Stewart Lee in the bar, ticket signed by him and Chris Collingwood",Rich / Stem,N,,,29/09/1997Astoria 2,Astoria 2,1997,9,29
31/01/1998,Green Day,,Brixton Academy,£10.00,,Rich / Stem / Paul G / Wellings,N,,,31/01/1998Brixton Academy,Brixton Academy,1998,1,31
24/01/1998,Midget,Idlewild,The Forum,£3.00,,Rich / Stem,N,,,24/01/1998The Forum,The Forum,1998,1,24
27/02/1998,Catherine Wheel,,The Forum,£3.00,Dev’s birthday outing,Rich / Stem / Kate,N,,,27/02/1998The Forum,The Forum,1998,2,27
12/03/1998,Urusei Yatsura,,Hanover Grand,£6.00,"It was over 18s and they were ID'ing people, I wasn't 18 for another 2 weeks so was worried about getting in.",Rich / Stem/ Wellings,N,,,12/03/1998Hanover Grand,Hanover Grand,1998,3,12
27/05/1998,Symposium,,Astoria,£7.00,,Rich / Stem,N,,,27/05/1998Astoria,Astoria,1998,5,27
19/06/1998,Grimsby,Adagio,The Coach House,£-,"Med's band, supported by Adagio (Oli Pluck's band)",Meds / Stem / Rich / Kate,N,,,19/06/1998The Coach House Public House,The Coach House Public House,1998,6,19
23/06/1998,Glastonbury Festival,,Worthy Farm,£80.00,Muddy. Camped with Clair who we met in Newquay.,Rich / Stem / Sally / Wellings,Y,Blur / Primal Scream / Robbie Williams / Pulp / Bob dylan / Chemical Brothers,,23/06/1998Worthy Farm,Worthy Farm,1998,6,23
28/08/1998,Reading Festival,,Richfield Avenue,£75.00,,Rich / Stem / Miller / Sally,Y,Deftones / Ash / Beastie Boys / Prodigy / Grandaddy / Yo La Tengo / Idlewild / Snug / Llama Farmers / Fungus,,28/08/1998Little John's Farm,Little John's Farm,1998,8,28
03/02/1999,Blur,,Oxford Brookes Uni,£15.00,"13 album release show, played Song 2 twice",Rich,N,,,03/02/1999Oxford Brookes Students' Union,Oxford Brookes Students' Union,1999,2,3
27/03/1999,Snug,,Water Rats,£3.50,,Rich,N,,,27/03/1999Monto Water Rats,Monto Water Rats,1999,3,27
09/04/1999,Snug,,West End Centre,£5.00,Bootlegged into Dev’s dictaphone. Nearly got thrown out because security thought we were doing drugs in the toilet (we were actually setting up the mic),Rich / Stem / Meds,N,,,09/04/1999West End Centre,West End Centre,1999,4,9
04/06/1999,Snug,,The Point,£4.00,,Rich,N,,,04/06/1999The Point,The Point,1999,6,4
17/06/1999,Snug,,Alleycat,£3.00,,Rich,N,,,17/06/1999Alleycat,Alleycat,1999,6,17
23/06/1999,Glastonbury Festival,,Worthy Farm,£83.00,"Sunny, met Stem whilst crowd surfing during Skunk Anansie",Rich / Stem / Miller,Y,REM / Fatboy Slim / Skunk Anansie / Lonnie Donegan / Fun Lovin' Criminals / Ash / Elliot Smith / Dogstar / Fungus / Ultrasound,,23/06/1999Worthy Farm,Worthy Farm,1999,6,23
27/08/1999,Reading Festival,,Richfield Avenue,£78.00,"Video on Symposium single CD of ""Hard Day's Night"" performance has me crowd surfing",Rich / Will / Stem / Phil,Y,The Chemical Brothers / BIS / The Dandy Warhols / Blur / Fun Lovin' Criminals / Beth Orton / Sebadoh / Sleater Kinney / Idlewild / Symposium / The Offspring / Feeder / Fountains of Wayne,,27/08/1999Little John's Farm,Little John's Farm,1999,8,27
22/12/1999,Snug,,Water Rats,£4.00,Acoustic,Rich / Stem / Meds,N,,,22/12/1999Monto Water Rats,Monto Water Rats,1999,12,22
16/08/2000,Bloodhound Gang,,Astoria,£10.00,Got Jimmy's puke covered hat,Rich / Stem,N,,,16/08/2000Astoria,Astoria,2000,8,16
21/06/2000,Glastonbury Festival,,Worthy Farm,£87.00,Backstage passes from Lizz who played New Bands tent with Justin Lewis Orchestra,Lizz / Stem / Meds / Rich,Y,David Bowie / Chemical Brothers / Bloodhound Gang / Semisonic / Jools Holland / Basement Jaxx / Idlewild / Feeder / Dandy Warhols / Flaming Lips,,21/06/2000Worthy Farm,Worthy Farm,2000,6,21
26/08/2000,Reading Festival,,Richfield Avenue,£80.00,,Rich / Stem / Meds / Will / Phil,Y,Daphne and Celeste / A / Blink 182 / Rage Against The Machine / Slipknot / Placebo / Stereophonics / Elliot Smith / Pulp / Beck / Idlewild / Deftones / Grandaddy / Limp Bizkit / Foo Fighters / Oasis / The Get Up Kids,,26/08/2000Little John's Farm,Little John's Farm,2000,8,26
11/09/2000,No use for a name,Nerf Herder,Wedgewood Rooms,£7.00,Met Nerf Herder and got ticket signed,Rich / Stem,N,,,11/09/2000Wedgewood Rooms,Wedgewood Rooms,2000,9,11
14/09/2000,No use for a name,Nerf Herder,LA2,£8.00,I played guitar on stage during Golf Shirt.,Rich / Stem,N,,,14/09/2000Astoria 2,Astoria 2,2000,9,14
03/07/2001,Weezer,Jimmy Eat World / Crackout,Shepherds Bush Empire,£12.50,We stayed at Al's sister's house every night. Got t-shirts made with fanclub photos on.,Al / Rich / Stem / Lizz,N,,,03/07/2001Shepherd's Bush Empire,Shepherd's Bush Empire,2001,7,3
04/07/2001,Weezer,Jimmy Eat World / Crackout,Shepherds Bush Empire,£12.50,"Saw Pat afterward and got ticket signed, a guy had Mickey's bass, there's a photo of Dev with it",Al / Rich / Stem,N,,,04/07/2001Shepherd's Bush Empire,Shepherd's Bush Empire,2001,7,4
05/07/2001,Weezer,Jimmy Eat World / Crackout,Shepherds Bush Empire,£12.50,,Al / Rich / Stem,N,,,05/07/2001Shepherd's Bush Empire,Shepherd's Bush Empire,2001,7,5
07/07/2001,Radiohead,Sigur Ros,South Park,£27.50,,Rich,N,,,07/07/2001South Park,South Park,2001,7,7
24/08/2001,Reading Festival,,Richfield Avenue,£80.00,Ash played a cover of Only In Dreams,Rich / Meds / Phil,Y,Staind / Eminem / Marilyn Manson / Papa Roach / Xzbit / D12 / Alien Ant Farm / American HiFi / Green Day / Eels / Ash / Feeder,,24/08/2001Little John's Farm,Little John's Farm,2001,8,24
25/01/2002,Jimmy Eat World,,Astoria,£10.00,,Rich,N,,,25/01/2002Astoria,Astoria,2002,1,25
09/03/2002,Crackout,,The Forum,£5.00,,Rich / Al / Kate,N,,,09/03/2002The Forum,The Forum,2002,3,9
21/03/2002,Weezer,,Carling Academy,£13.50,,Rich,N,,,21/03/2002Academy Birmingham,Academy Birmingham,2002,3,21
23/03/2002,Weezer,,Guildhall,£13.50,,Rich,N,,,23/03/2002Southampton Guildhall,Southampton Guildhall,2002,3,23
24/03/2002,Weezer,,Brixton Academy,£18.50,,Rich / Stem / Al,N,,,24/03/2002Brixton Academy,Brixton Academy,2002,3,24
15/05/2002,Saves The Day,,Mean Fiddler,£8.50,Booted,Rich,N,,,15/05/2002Astoria 2,Astoria 2,2002,5,15
20/05/2002,Crackout,,Barfly Camden,£4.00,Booted,Rich / Al,N,,,20/05/2002Barfly,Barfly,2002,5,20
26/06/2002,Glastonbury Festival,,Worthy Farm,£97.00,The fence went up,Al / Donna / Mag / Rich / Meds / Stem,Y,Ash / Bush / Ed Harcourt / Idlewild / No Doubt / Belle and Sebestian / Air / Hundred Reasons / Groove Armada / Stereophonics / Coldplay / Rolf Harris / Mis-teeq / Fat Boy Slim / White Stripes,,26/06/2002Worthy Farm,Worthy Farm,2002,6,26
14/07/2002,Weezer,Dashboard Confessional / AM Radio,Molson Amphitheatre,CD45,,Rich,N,,,14/07/2002Molson Amphitheatre,Molson Amphitheatre,2002,7,14
21/07/2002,Weezer,Dashboard Confessional / Sparta / Home Town Hero / AM Radio,Tweeter Centre,USD30,,Rich,N,,,21/07/2002Tweeter Center for the Performing Arts,Tweeter Center for the Performing Arts,2002,7,21
29/07/2002,Weezer,Dashboard Confessional / Sparta / Home Town Hero / The Special Goodness / AM Radio,Hi-Fi Buys Amphitheatre,USD30,"Got backstage passes, played dice with Chris Carraba, foosball with Pat, and met Rivers",Rich,N,,,29/07/2002Lakewood Amphitheatre,Lakewood Amphitheatre,2002,7,29
13/01/2003,Get Up Kids,,ULU,£12.00,Booted,Rich,N,,,13/01/2003ULU,ULU,2003,1,13
16/01/2003,Dashboard Confessional,,The Metro,Comp,Waited outside until they let us in for an acoustic set we booted,Rich,N,,,16/01/2003The Metro Club,The Metro Club,2003,1,16
25/03/2003,Avril Lavigne,,Brixton Academy,£15.00,,Rich / Stem / Al,N,,,25/03/2003Brixton Academy,Brixton Academy,2003,3,25
17/04/2003,Hiding with girls,One Word Answer,Jumpin Jaks,£3.00,Supported by One Word Answer (Steve Moore's band),Rich / Al,N,,,17/04/2003Jumpin Jaks,Jumpin Jaks,2003,4,17
02/06/2003,Brand New,,Barfly Camden,£7.50,,Rich,N,,,02/06/2003Barfly,Barfly,2003,6,2
20/06/2003,Nerf Herder,,The Garage,£8.00,,Rich,N,,,20/06/2003The Garage,The Garage,2003,6,20
15/07/2003,All American Rejects,,The Garage,£7.00,,Rich,N,,,15/07/2003The Garage,The Garage,2003,7,15
29/07/2003,Rooney,,100 Club,£7.00,,Rich,N,,,29/07/2003100 Club,100 Club,2003,7,29
15/08/2003,Dashboard Confessional,,Astoria,£10.00,Venue changed from Mean Fiddler,Rich,N,,,15/08/2003Astoria,Astoria,2003,8,15
06/09/2003,Rufio,One Word Answer,The Free Butt Pheonix,£4.00,Supported by One Word Answer (Steve Moore's band),Rich,N,,,06/09/2003The Freebutt,The Freebutt,2003,9,6
03/11/2003,The Flaming Lips,,Carling Apollo Hammersmith,£18.50,,Rich / Stem,N,,,03/11/2003Hammersmith Apollo,Hammersmith Apollo,2003,11,3
08/11/2003,Dashboard Confessional,,Shepherds Bush Empire,£12.00,,Rich / Stem / Al,N,,,08/11/2003Shepherd's Bush Empire,Shepherd's Bush Empire,2003,11,8
26/11/2003,Radiohead,,Earls Court Olympia,£28.50,,Rich,N,,,26/11/2003Earls Court Olympia,Earls Court Olympia,2003,11,26
03/03/2004,Fountains of Wayne,,Astoria,£12.00,,Rich,N,,,03/03/2004Astoria,Astoria,2004,3,3
03/04/2004,The X04 Festival,,Brighton Centre,£7.50,Lizz played with Outroads,Rich / Stem,Y,Outroads,,03/04/2004Brighton Centre,Brighton Centre,2004,4,3
03/05/2004,Britney,,Wembley Arena,£27.50,,Rich,N,,,03/05/2004Wembley Arena,Wembley Arena,2004,5,3
05/05/2004,Britney,,The NIA,£27.50,,Rich,N,,,05/05/2004National Indoor Arena,National Indoor Arena,2004,5,5
11/07/2004,Party in the park,,Hyde Park,£27.00,,Rich / Kate / Al,Y,Alanis Morissette / Anastacia / Avril Lavigne / Blue / Busted / Lenny Kravitz / McFly / Natasha Bedingfield / Nelly Furtado / Peter Andre / Sugarbabes / Will Young / The Corrs,,11/07/2004Hyde Park,Hyde Park,2004,7,11
31/07/2004,Busted,McFly,Broadstairs,£25.00,Supported by McFly,Rich,N,,,31/07/2004St. George's,St. George's,2004,7,31
16/08/2004,Bloodhound Gang,,London Astoria,£12.50,,Rich,N,,,16/08/2004Astoria,Astoria,2004,8,16
17/08/2004,Ed Harcourt,,Lock 17,£12.50,,Rich,N,,,17/08/2004Dingwalls,Dingwalls,2004,8,17
24/08/2004,Dashboard Confessional,,Carling Academy Islington,£12.50,,Rich,N,,,24/08/2004Academy Islington,Academy Islington,2004,8,24
11/11/2004,Matt Sharp and Golden Boy,,Redux,Comp,Dev emailed someone and we got added to the first list,Rich,N,,,11/11/2004Redux,Redux,2004,11,11
15/11/2004,Ed Harcourt,Magic Numbers,Madame JoJo's,£13.50,,Rich,N,,,15/11/2004Madame JoJo's,Madame JoJo's,2004,11,15
14/12/2004,Blink 182,,Carling Academy,£21.50,Last UK show?,Rich,N,,,14/12/2004Brixton Academy,Brixton Academy,2004,12,14
28/01/2005,Taking Back Sunday,,Carling Academy,£13.00,,Rich,N,,,28/01/2005Brixton Academy,Brixton Academy,2005,1,28
15/03/2005,Rilo Kiley,,Borderline,£7.50,,Rich,N,,,15/03/2005The Borderline,The Borderline,2005,3,15
22/03/2005,Jimmy Eat World,,Astoria,£15.00,,Rich,N,,,22/03/2005Astoria,Astoria,2005,3,22
01/05/2005,Deconstruction,,Astoria,£17.50,,Rich,Y,Mad Caddies / Boysetsfire / From Autumn To Ashes / Capdown,,01/05/2005Astoria,Astoria,2005,5,1
11/05/2005,The Magic Numbers,,Concorde 2,£7.00,He cried when we all sang along,Rich,N,,,11/05/2005Concorde 2,Concorde 2,2005,5,11
22/05/2005,A,,Concorde 2,£10.00,Weirdly empty,Rich,N,,,22/05/2005Concorde 2,Concorde 2,2005,5,22
07/06/2005,Weezer,,Vicar Street,EU32.00,,Rich / Al,N,,,07/06/2005Vicar Street,Vicar Street,2005,6,7
13/06/2005,Weezer,,Carling Academy,£23.50,Bootlegged,Rich,N,,,13/06/2005Academy Birmingham,Academy Birmingham,2005,6,13
14/06/2005,Weezer,,Carling Academy,£26.50,Bootlegged,Rich / Al,N,,,14/06/2005Brixton Academy,Brixton Academy,2005,6,14
15/06/2005,Weezer,,Carling Academy,£26.50,,Rich / Al,N,,,15/06/2005Brixton Academy,Brixton Academy,2005,6,15
24/06/2005,Glastonbury Festival,,Worthy Farm,£125.00,Saw Little Liz play on Wednesday. Wild flooding - we had a stream flowing past our tent.,Mag / Rich / Al / Baillie / Donna,Y,The White Stripes / The Killers / Coldplay / Ash / Goldie Lookin Chain / Rilo Kiley / The Subways / Basement Jaxx / Brian Wilson / Van Morrison / Jools Holland / Cake / Bright Eyes,,24/06/2005Worthy Farm,Worthy Farm,2005,6,24
11/07/2005,Bright Eyes,,Somerset House,£22.50,,Rich,N,,,11/07/2005Somerset House,Somerset House,2005,7,11
14/07/2005,Ed Harcourt,,St Pauls Church,£6.00,Had a chat with Ed H before the show,Rich,N,,,14/07/2005St Paul's Church,St Paul's Church,2005,7,14
04/08/2005,Ed Harcourt,,100 Club,£12.50,,Rich,N,,,04/08/2005100 Club,100 Club,2005,8,4
11/08/2005,Wild Boar,,Barfly Camden,£5.00,,Rich,N,,,11/08/2005Barfly,Barfly,2005,8,11
22/08/2005,Weezer,,Carling Apollo Hammersmith,£26.50,,Rich,N,,,22/08/2005Hammersmith Apollo,Hammersmith Apollo,2005,8,22
16/09/2005,The Starting Line,,Mean Fiddler,£12.00,,Rich,N,,,16/09/2005Astoria 2,Astoria 2,2005,9,16
28/09/2005,Trachtenburg Family Slideshow Players,,Bloomsbury Theatre,£13.50,,Rich / Kate,N,,,28/09/2005Bloomsbury Theatre,Bloomsbury Theatre,2005,9,28
30/09/2005,Outroads,,Spice of Life,£5.00,,Rich,N,,,30/09/2005Spice of Life,Spice of Life,2005,9,30
12/10/2005,A,,Astoria,£12.50,,Rich,N,,,12/10/2005Astoria,Astoria,2005,10,12
16/10/2005,Bowling for Soup,,Astoria,£15.00,,Rich,N,,,16/10/2005Astoria,Astoria,2005,10,16
25/10/2005,American Hi-Fi,,The Garage,£10.00,,Rich,N,,,25/10/2005The Garage,The Garage,2005,10,25
02/11/2005,Wir Sind Helden,,The Garage,£8.50,,Rich,N,,,02/11/2005The Garage,The Garage,2005,11,2
04/11/2005,My Chemical Romance,,Carling Academy,£15.00,,Rich,N,,,04/11/2005Brixton Academy,Brixton Academy,2005,11,4
09/11/2005,Bloodhound Gang,,Astoria,£14.00,,Rich,N,,,09/11/2005Astoria,Astoria,2005,11,9
08/12/2005,Beth Orton,,Spitz,£17.50,Warm up gig for new album,Rich,N,,,08/12/2005Spitz,Spitz,2005,12,8
10/01/2006,OK Go,,Metro Club,£6.00,Did the cool dance,Rich,N,,,10/01/2006The Metro Club,The Metro Club,2006,1,10
22/01/2006,The Starting Line,MXPX,Astoria,£13.50,,Rich,N,,,22/01/2006Astoria,Astoria,2006,1,22
26/01/2006,Taking Back Sunday,,Carling Academy Islington,£12.00,,Rich,N,,,26/01/2006Academy Islington,Academy Islington,2006,1,26
18/02/2006,All American Rejects,,Shepherds Bush Empire,£13.00,,Rich,N,,,18/02/2006Shepherd's Bush Empire,Shepherd's Bush Empire,2006,2,18
28/03/2006,Nada Surf,,Shepherds Bush Empire,£12.50,,Rich,N,,,28/03/2006Shepherd's Bush Empire,Shepherd's Bush Empire,2006,3,28
07/05/2006,Me First and the Gimme Gimmes,,Astoria,£15.00,,Rich,N,,,07/05/2006Astoria,Astoria,2006,5,7
20/05/2006,Taking Back Sunday,,Carling Academy,£13.50,,Rich,N,,,20/05/2006Academy Birmingham,Academy Birmingham,2006,5,20
13/06/2006,Angels & Airwaves,,Carling Academy,£16.00,First UK show,Rich,N,,,13/06/2006Brixton Academy,Brixton Academy,2006,6,13
16/06/2006,All American Rejects,,Hammersmith Palais,£13.00,,Rich,N,,,16/06/2006Hammersmith Palais,Hammersmith Palais,2006,6,16
22/08/2006,Dashboard Confessional,Frank Turner,Barfly Camden,£13.00,Acoustic set,Rich,N,,,22/08/2006Barfly,Barfly,2006,8,22
09/09/2006,Brand New,,Carling Academy,£12.50,,Rich,N,,,09/09/2006Brixton Academy,Brixton Academy,2006,9,9
29/08/2006,Hawthorne Heights,,Carling Academy Islington,£10.00,,Rich,N,,,29/08/2006Academy Islington,Academy Islington,2006,8,29
07/09/2006,Bloodhound Gang,,Koko,£15.00,,Rich,N,,,07/09/2006KOKO,KOKO,2006,9,7
05/09/2006,Ben Kweller,,Dingwalls,£12.50,,Rich,N,,,05/09/2006Dingwalls,Dingwalls,2006,9,5
21/08/2006,Taking Back Sunday,,93 Feet East,£10.00,Amazing! Played whole of Louder Now followed by requests from the crowd for another 45 mins,Rich,N,,,21/08/200693 Feet East,93 Feet East,2006,8,21
12/10/2006,Deftones,,Electric Ballroom,£19.50,Excellent sound,Rich,N,,,12/10/2006Electric Ballroom,Electric Ballroom,2006,10,12
19/09/2006,44,,Astoria,£15.00,First UK show,Rich,N,,,19/09/2006Astoria,Astoria,2006,9,19
29/09/2006,All American Rejects,,Carling Academy,£15.00,,Rich,N,,,29/09/2006Brixton Academy,Brixton Academy,2006,9,29
04/11/2006,The Flaming Lips,,Brighton Centre,£20.00,Girl had seizure,Rich,N,,,04/11/2006Brighton Centre,Brighton Centre,2006,11,4
27/11/2006,The Killers,,Carling Academy,£23.50,,Rich,N,,,27/11/2006Brixton Academy,Brixton Academy,2006,11,27
01/12/2006,New Found Glory,,Astoria,£16.50,,Rich,N,,,01/12/2006Astoria,Astoria,2006,12,1
18/12/2006,Tenacious D,,Brighton Centre,£25.00,,Rich,N,,,18/12/2006Brighton Centre,Brighton Centre,2006,12,18
10/02/2007,Sense Fail,,Carling Academy Islington,£10.00,,Rich,N,,,10/02/2007Academy Islington,Academy Islington,2007,2,10
13/02/2007,Brand New,,Shepherds Bush Empire,£15.00,,Rich,N,,,13/02/2007Shepherd's Bush Empire,Shepherd's Bush Empire,2007,2,13
18/02/2007,The Get Happy Tour,,Hammersmith Palais,£16.50,,Rich,Y,Bowling for Soup / Wheatus / Son of Dork,,18/02/2007Hammersmith Palais,Hammersmith Palais,2007,2,18
10/03/2007,Enter Shikari,,Hammersmith Palais,£11.00,Last gig before it was knocked down,Rich,N,,,10/03/2007Hammersmith Palais,Hammersmith Palais,2007,3,10
24/03/2007,Son of Dork,,Shepherds Bush Empire,£16.50,The Sic Tour,Rich,N,,,24/03/2007Shepherd's Bush Empire,Shepherd's Bush Empire,2007,3,24
23/04/2007,Moneen,Bayside,Underworld Camden,£10.00,,Rich,N,,,23/04/2007The Underworld,The Underworld,2007,4,23
28/04/2007,Give It A Name,,Earls Court Olympia,£32.50,,Rich,Y,Brand New / Kevin Richine / Enter Shikari / Zebra Head,,28/04/2007Earls Court Olympia,Earls Court Olympia,2007,4,28
02/05/2007,Kevin Richine,,93 Feet East,£7.00,,Rich,N,,,02/05/200793 Feet East,93 Feet East,2007,5,2
22/06/2007,Glastonbury Festival,,Worthy Farm,£145.00,Muddy,Meds / Rich / Al / Mag / Donna / Baillie,Y,Damien Rice / Bright Eyes / The Killers / Chemical Brothers / The Magic Numbers / Bloc Party,,22/06/2007Worthy Farm,Worthy Farm,2007,6,22
29/06/2007,Me First and the Gimme Gimmes,,Kentish Town Forum,£15.00,,Rich,N,,,29/06/2007Kentish Town Forum,Kentish Town Forum,2007,6,29
20/08/2007,Kevin Richine,,Metro Club,£7.50,,Rich,N,,,20/08/2007The Metro Club,The Metro Club,2007,8,20
21/09/2007,Wir Sind Helden,,Mean Fiddler,£12.50,,Rich,N,,,21/09/2007Astoria 2,Astoria 2,2007,9,21
25/09/2007,Manchester Orchestra,,Carling Academy Islington,£7.00,,Rich,N,,,25/09/2007Academy Islington,Academy Islington,2007,9,25
22/10/2007,The Get Happy Tour,,Carling Academy,£17.50,,Rich,Y,Bowling for Soup / Bloodhound Gang,,22/10/2007Brixton Academy,Brixton Academy,2007,10,22
31/12/2007,XFM NYE,,Carling Academy,£-,Comp,Mark / Rich / Cathy,N,,,31/12/2007Brixton Academy,Brixton Academy,2007,12,31
20/01/2008,Dashboard Confessional,,Scala,£14.00,Solo Acoustic,Rich,N,,,20/01/2008Scala,Scala,2008,1,20
18/02/2008,Jimmy Eat World,,Carling Academy,£18.50,,Rich,N,,,18/02/2008Brixton Academy,Brixton Academy,2008,2,18
14/05/2008,The Movielife,,The Peel,£9.00,,Rich,N,,,14/05/2008The Peel,The Peel,2008,5,14
16/05/2008,Kevin Richine,,Borderline,£7.50,,Rich,N,,,16/05/2008The Borderline,The Borderline,2008,5,16
22/05/2008,Give It A Name Introduces,,Carling Academy,£5.00,,Rich,Y,Four Year Strong / Meg & Dia / Mayday Parade,,22/05/2008Brixton Academy,Brixton Academy,2008,5,22
27/06/2008,Glastonbury Festival,,Worthy Farm,£175.00,,Meds / Rich / Al / Mag / Donna / Baillie / Phil / Taylor,Y,Seasick Steve / Lightspeed Champion / Hadouken! / Get Cape Wear Cape Fly / Jay-Z / Suzanne Vega / Manu Chau / King SOloman Burke,,27/06/2008Worthy Farm,Worthy Farm,2008,6,27
05/09/2008,Ash,,Roundhouse,£19.77,"1977 in it's entirety followed by b-sides and greatest hits, saw Sally in the subway before the show (we were just back in contact)",Rich,N,,,05/09/2008Roundhouse,Roundhouse,2008,9,5
13/09/2008,Beth Orton,The Magic Numbers,Southbank Centre,£20.00,,Rich,N,,,13/09/2008Southbank Centre,Southbank Centre,2008,9,13
25/10/2008,Freeze Festival,,Battersea Power Station,£27.50,,Rich / Donna / Baillie,Y,Cypress Hill / Iglu & Hartley,,25/10/2008Battersea Power Station,Battersea Power Station,2008,10,25
09/12/2008,Bayside,Hit the Lights,Carling Academy Islington,£10.00,,Rich,N,,,09/12/2008Academy Islington,Academy Islington,2008,12,9
17/12/2008,The Mighty Boosh,,The o2,£27.50,,Rich,N,,,17/12/2008The O2 Arena,The O2 Arena,2008,12,17
19/04/2009,Give It A Name Incoming,,O2 Academy Brixton,£22.50,,Rich,Y,Taking Back Sunday / Underoath / Thursday / Innerpartysystem,,19/04/2009Brixton Academy,Brixton Academy,2009,4,19
30/05/2009,New Found Glory,Bayside,HMV Kentish Town Forum,£16.50,,Rich,N,,,30/05/2009Kentish Town Forum,Kentish Town Forum,2009,5,30
09/06/2009,The All American Rejects,,Roundhouse,£16.50,,Rich,N,,,09/06/2009Roundhouse,Roundhouse,2009,6,9
22/06/2009,Moneen,,Barfly Camden,£7.00,,Rich,N,,,22/06/2009Barfly,Barfly,2009,6,22
26/06/2009,Glastonbury Festival,,Worthy Farm,£185.00,Sally joined us - she had managed to buy a ticket from HMV just weeks beforehand. We kissed.,Baillie / Phil / Al / Donna / Rich / Meds / Mike / Sally / Stem / Taylor,Y,Bloc Party / Ting Tings / Rolf Harris / Dizzee Rascal / Lisa Hannigan / Seth Lakeman / Newton Faulkner / 2 Many DJs / Brand New / Enter Shikari / Roots Manuva / The Prodigy / Tom Jones / Madness / The Specials / Status Quo / Tony Christie,,26/06/2009Worthy Farm,Worthy Farm,2009,6,26
21/07/2009,Manchester Orchestra,Kevin Richine,Institute of Contemporary Arts,£9.50,,Rich,N,,,21/07/2009Institute of Contemporary Arts,Institute of Contemporary Arts,2009,7,21
22/07/2009,Kevin Richine,,The Old Blue Last,£-,Comp,Rich,N,,,22/07/2009The Old Blue Last,The Old Blue Last,2009,7,22
04/08/2009,Taking Back Sunday,,Heaven,£15.00,,Rich,N,,,04/08/2009Heaven,Heaven,2009,8,4
19/08/2009,The Get Up Kids,,Electric Ballroom,£15.00,,Rich,N,,,19/08/2009Electric Ballroom,Electric Ballroom,2009,8,19
22/08/2009,New Found Glory,International Superheroes of Hardcore,Relentless Garage,£16.50,,Rich,N,,,22/08/2009The Garage,The Garage,2009,8,22
27/08/2009,Right Away Great Captain,,Water Rats,£9.50,We went on our way to Reading Festival,Rich / Stem,N,,,27/08/2009Monto Water Rats,Monto Water Rats,2009,8,27
27/08/2009,Reading Festival,,Richfield Avenue,£175.00,,Rich / Meds / Phil,Y,Billy Talent / Rise Against / Radiohead,,27/08/2009Little John's Farm,Little John's Farm,2009,8,27
16/10/2009,Idlewild,,Electric Ballroom,£16.00,,Rich / Stem,N,,,16/10/2009Electric Ballroom,Electric Ballroom,2009,10,16
29/10/2009,Frank Turner,,O2 Shepherd's Bush Empire,£13.00,,Rich,N,,,29/10/2009Shepherd's Bush Empire,Shepherd's Bush Empire,2009,10,29
19/12/2009,Frank Turner,,Union Chapel,£13.00,,Sally / Rich,N,,,19/12/2009Union Chapel,Union Chapel,2009,12,19
23/01/2010,Brand New,,Wembley Arena,£21.97,,Rich / Stem,N,,,23/01/2010Wembley Arena,Wembley Arena,2010,1,23
11/05/2010,Ed Harcourt,,The Pigalle Club,£16.50,,Rich / Sally,N,,,11/05/2010The Pigalle Club,The Pigalle Club,2010,5,11
29/05/2010,Slam Dunk Festival,,Hereford University,£32.50,Met Ads and Russ,Rich,Y,New Found Glory / Four Year Strong / Sonic Boom Six / Straight Lines / Deaf Havana / Moneen,,29/05/2010The Forum Hertfordshire,University of Hertfordshire,2010,5,29
25/06/2010,Glastonbury Festival,,Worthy Farm,£195.00,,Sally / Rich / Al / Baillie / Meds / Donna / Mike,Y,Gorillaz / Dizzee Rascal / Snoop Dogg / Rolf Harris / Muse / Seasick Steve / Coheed and Cambria / Rordigo y Gabriella / Dan le Sac vs Scroobious pip / Frank Turner / Seth Lakeman / Stornoway / Biffy CLyro / I Blame Coco / Adam F / Snap / Ratpack,,25/06/2010Worthy Farm,Worthy Farm,2010,6,25
27/10/2010,Black Cards,,Institute of Contemporary Arts,£8.00,Pete Wentz's new band,Rich,N,,,27/10/2010Institute of Contemporary Arts,Institute of Contemporary Arts,2010,10,27
02/11/2010,Rodrigo y Gabriela,,O2 Shepherd's Bush Empire,£28.00,,Sally / Meds / Rich,N,,,02/11/2010Shepherd's Bush Empire,Shepherd's Bush Empire,2010,11,2
10/11/2010,Four Year Strong,,Electric Ballroom,£10.00,,Rich,N,,,10/11/2010Electric Ballroom,Electric Ballroom,2010,11,10
17/11/2010,Deftones,,O2 Academy Brixton,£32.50,,Rich / Meds / Stem,N,,,17/11/2010Brixton Academy,Brixton Academy,2010,11,17
23/11/2010,Jimmy Eat World,,O2 Academy Brixton,£23.50,,Rich,N,,,23/11/2010Brixton Academy,Brixton Academy,2010,11,23
14/12/2010,Idlewild,,Relentless Garage,£18.50,,Rich,N,,,14/12/2010The Garage,The Garage,2010,12,14
04/02/2011,Angels & Airwaves,,HMV Kentish Town Forum,£18.50,,Rich,N,,,04/02/2011Kentish Town Forum,Kentish Town Forum,2011,2,4
20/02/2011,The Wonder Years,,The Peel,£10.00,,Rich,N,,,20/02/2011The Peel,The Peel,2011,2,20
10/03/2011,Amateur Transplants,,Wilton's Music Hall,£7.50,Geek Pop Launch Party,Donna / Sally / Rich,N,,,10/03/2011Wilton's Music Hall,Wilton's Music Hall,2011,3,10
14/04/2011,Manchester Orchestra,,XOYO,£14.50,,Rich,N,,,14/04/2011XOYO,XOYO,2011,4,14
15/04/2011,Bowling For Soup,,Koko,£18.50,Acoustic Evening with Eric and Jared (started at 7.45pm and played until 10pm!),Rich,N,,,15/04/2011KOKO,KOKO,2011,4,15
19/04/2011,Thursday,,KCLSU,£18.00,,Rich / Chris,N,,,19/04/2011King's College London Student Union (KCLSU),King's College London Student Union (KCLSU),2011,4,19
26/05/2011,Frank Turner,,The Hippodrome,£8.00,,Rich,N,,,26/05/2011The Hippodrome,The Hippodrome,2011,5,26
29/05/2011,Slam Dunk Festival,,Hereford University,£32.50,,Rich,Y,Set your goals / Mayday Parade / The Starting Line / We Are the In Crowd / The Dangerous Summer / Hit The Lights / The Famous Class / A Loss For Words / Dance Gavin Dance,,29/05/2011University of Hertfordshire,University of Hertfordshire,2011,5,29
22/06/2011,Glastonbury Festival,,Worthy Farm,£205.00,Pulp and Radiohead were secret sets at The Park,Sally / Rich / Donna / Mike / Al / Phil / Stem / Sophie,Y,Beyonce / Pendulum / Jimmy Eat World / Pulp / Radiohead / Jessie J / Suzanne Vega / The Streets / Seth Lakeman / The Chemical Brothers / Eels,,22/06/2011Worthy Farm,Worthy Farm,2011,6,22
06/07/2011,Weezer,,O2 Academy Brixton,£35.00,,Rich,N,,,06/07/2011Brixton Academy,Brixton Academy,2011,7,6
07/10/2011,Manchester Orchestra,,Koko,£15.00,,Rich,N,,,07/10/2011KOKO,KOKO,2011,10,7
16/12/2011,Ed Harcourt,,Bush Hall,£15.00,,Rich,N,,,16/12/2011Bush Hall,Bush Hall,2011,12,16
11/02/2012,Brand New,,Roundhouse,£23.50,,Rich,N,,,11/02/2012Roundhouse,Roundhouse,2012,2,11
17/02/2012,New Found Glory,,Roundhouse,£23.50,,Rich,N,,,17/02/2012Roundhouse,Roundhouse,2012,2,17
27/02/2012,Kevin Richine,,The Borderline,£9.00,,Rich / Sally,N,,,27/02/2012The Borderline,The Borderline,2012,2,27
12/04/2012,Andrew WK,,HMV Kentish Town Forum,£17.50,,Rich,N,,,12/04/2012Kentish Town Forum,Kentish Town Forum,2012,4,12
23/04/2012,The Wonder Years,I Am The Avalanche,The Peel,£12.50,,Rich,N,,,23/04/2012The Peel,The Peel,2012,4,23
03/05/2012,Dan Mangan,,Bush Hall,£15.00,,Sally / Rich,N,,,03/05/2012Bush Hall,Bush Hall,2012,5,3
04/06/2012,Banquet's Big Day Out,,Imber Court,£25.00,,Rich,Y,The Computers / MC Lars / Wheatus / Deaf Havana / Hundred Reasons / Kids In Glass Houses,,04/06/2012Imber Court Sports Club,Imber Court Sports Club,2012,6,4
11/06/2012,Kevin Richine,,Birthday's,£12.00,,Rich / Stem,N,,,11/06/2012Birthdays,Birthdays,2012,6,11
02/08/2012,Vinnie Caruana,,The Fighting Cocks,£9.00,,Rich,N,,,02/08/2012The Fighting Cocks,The Fighting Cocks,2012,8,2
04/09/2012,Grandaddy,,O2 Shepherd's Bush Empire,£20.00,,Rich / Stem,N,,,04/09/2012Shepherd's Bush Empire,Shepherd's Bush Empire,2012,9,4
08/09/2012,Proms in the Park,,Hyde Park,£35.00,"Terry Wogan presented, Sally was pregnant and secretly not drinking, I secretly drank all her champagne",Rich / Sally / Miller,Y,Alfie Boe / Il Divo / Kylie Minogue,,08/09/2012Hyde Park,Hyde Park,2012,9,8
05/10/2012,Mayday Parade,,The Peel,£12.50,,Rich,N,,,05/10/2012The Peel,The Peel,2012,10,5
19/12/2012,Ed Harcourt,,Cecil Sharp House,£18.50,,Rich,N,,,19/12/2012Cecil Sharp House,Cecil Sharp House,2012,12,19
19/01/2013,The Beggars Collective,,Barfly Camden,£6.00,,Rich / Meds / Sally / Donna / Al,N,,,19/01/2013Barfly,Barfly,2013,1,19
26/04/2013,The Starting Line,,Kentish Town Forum,£20.00,,Rich,N,,,26/04/2013Kentish Town Forum,Kentish Town Forum,2013,4,26
26/05/2013,Slam Dunk Festival,,Hereford University,£35.00,"We had cupcakes, crazy queues to get into main building for FYS",Rich,Y,All Time Low / Four Year Strong / We Are The In Crowd / The Wonder Years / The Early November,,26/05/2013University of Hertfordshire,University of Hertfordshire,2013,5,26
05/08/2013,The Menzingers,Tigers Jaw,The Fighting Cocks,£12.00,,Rich,N,,,05/08/2013The Fighting Cocks,The Fighting Cocks,2013,8,5
09/10/2013,Bowling For Soup,,Union Chapel,£15.00,Acoustic set,Rich,N,,,09/10/2013Union Chapel,Union Chapel,2013,10,9
23/10/2013,Bowling For Soup,,Eventim Apollo,£25.00,,Rich,N,,,23/10/2013Hammersmith Apollo,Hammersmith Apollo,2013,10,23
19/11/2013,Jimmy Eat World,,O2 Academy Brixton,£22.50,,Rich,N,,,19/11/2013Brixton Academy,Brixton Academy,2013,11,19
07/02/2014,Mayday Parade,,Koko,£12.50,,Rich,N,,,07/02/2014KOKO,KOKO,2014,2,7
12/04/2014,Brand New,,Troxy,£24.50,,Rich / Stem,N,,,12/04/2014Troxy,Troxy,2014,4,12
27/04/2014,Bayside,,The Fighting Cocks,£7.50,Acoustic set at Sunday lunchtime,Rich,N,,,27/04/2014The Fighting Cocks,The Fighting Cocks,2014,4,27
08/05/2014,The Wonder Years,,Scala,£13.50,We watched from upstairs,Rich,N,,,08/05/2014Scala,Scala,2014,5,8
07/10/2014,Manchester Orchestra,,O2 Shepherd's Bush Empire,£16.00,Incredible lineup,Stem / Rich,N,,,07/10/2014Shepherd's Bush Empire,Shepherd's Bush Empire,2014,10,7
24/11/2014,Allo Darlin,,Scala,£13.50,We watched from up on the balcony,Stem / Rich,N,,,24/11/2014Scala,Scala,2014,11,24
23/01/2015,Moose Blood,,The Borderline,£12.00,,Stem / Rich,N,,,23/01/2015The Borderline,The Borderline,2015,1,23
24/05/2015,Slam Dunk Festival,,Hereford University,£39.00,First outing after Eleanor was born (she was 2 weeks old),Rich,Y,You Me At Six / Taking Back Sunday / The Wonder Years / Bayside / Comeback Kid / Seaway / Lightyear / ROAM / Moose Blood / A Loss For Words / Only Rivals,,24/05/2015University of Hertfordshire,University of Hertfordshire,2015,5,24
18/06/2015,The Movielife,,Electric Ballroom,£22.00,,Rich,N,,,18/06/2015Electric Ballroom,Electric Ballroom,2015,6,18
05/04/2016,Weezer,,O2 Academy Brixton,£40.00,Went down the front!,Lizz / Stem / Rich,N,,,05/04/2016Brixton Academy,Brixton Academy,2016,4,5
30/05/2016,Slam Dunk Festival,,Hereford University,£42.00,We watched Moose Blood through the fence as there was a massive queue to get in,Stem / Rich,Y,New Found Glory / Mayday Parade / Moose Blood / Trashboat / ROAM / Hit The Lights / As It Is / Real Friends / Set Your Goals / Four Year Strong / The Starting Line,,30/05/2016University of Hertfordshire,University of Hertfordshire,2016,5,30
21/06/2017,Glastonbury Festival,,Worthy Farm,£215.00,Glamping with Rich. We had cheese and biscuits but no knife so used playing cards. First band we saw was Napalm Death in Block 13. We all went down the front for Foo Fighters on the Pyramid.,Rich / Sally,Y,Foo Fighters / Stormsy / Craig David / Kaiser Chiefs / Flaming Lips / Busted / Napalm Death / Seth Lakeman,,21/06/2017Worthy Farm,Worthy Farm,2017,6,21
27/09/2017,Mayday Parade,,Concorde 2,£18.00,,Rich,N,,,27/09/2017Concorde 2,Concorde 2,2017,9,27
28/10/2017,Weezer,Ash,Wembley Arena,£45.00,"Had cocktails in a hotel lobby beforehand, and stayed in a hotel",Rich / Stem / Sally,N,,,28/10/2017Wembley Arena,Wembley Arena,2017,10,28
10/03/2018,Moose Blood,,Roundhouse,£20.00,,Rich / Stem,N,,,10/03/2018Roundhouse,Roundhouse,2018,3,10
27/05/2018,Slam Dunk Festival,,Hatfield House Park,£50.00,Four Year Strong played an acoustic set in the woods,Rich / Stem / Chris,Y,Good Charlotte / State Champs / Lower Than Atlantis / Moose Blood / Twin Atlantic / Say Anything / The Audition / Roam / As It Is / Zebrahead,,27/05/2018Hatfield House,Hatfield House,2018,5,27
19/11/2018,Dashboard Confessional,Black Foxxes,Koko,£25.00,,Rich,N,,,19/11/2018KOKO,KOKO,2018,11,19
16/01/2019,Kevin Richine,,Camden Assembly,£13.00,,Rich,N,,,16/01/2019Camden Assembly,Camden Assembly,2019,1,16
23/02/2019,Mayday Parade,The Wonder Years,Troxy,£25.00,,Rich / Stem,N,,,23/02/2019Troxy,Troxy,2019,2,23
26/05/2019,Slam Dunk Festival,,Hatfield House Park,£59.50,Busted played secret set billed as Y3K. James Bourne retweeted my tweet.,Rich / Stem / Chris,Y,NOFX / The Menzingers / New Found Glory / Neck Deep / Real Friends / Tigers Jaw / A loss for words / The Get Up Kids / The Bomb Pops / Busted,,26/05/2019Hatfield House,Hatfield House,2019,5,26
27/09/2019,Aaron West and the Roaring Twenties,,The Garage,£22.00,The Garage beer was dreadful,Rich / Stem,N,,,27/09/2019The Garage,The Garage,2019,9,27
13/11/2019,Dashboard Confessional,,St Pancras Old Church,£23.00,For quite a while it seemed like this might be our last live gig due to Covid,Rich,N,,,13/11/2019St Pancras Old Church,St Pancras Old Church,2019,11,13
05/09/2021,Slam Dunk Festival,,Hatfield House Park,£65.00,Was on the rail for Frank Turner and a massive walking circle pit happened. Held in September due to Covid lockdown in May.,Meds / Laura / Gem / Phil / Rich / Stem / Chris,Y,A / McFly / Roam / As It Is / Mayday Parade / Statechamps / Frank Turner / Alkaline Trio / NOFX,,05/09/2021Hatfield House,Hatfield House,2021,9,5
04/06/2022,Slam Dunk Festival,,Hatfield House Park,£69.00,Lost my phone during Wonder Years (who played the whole of Upsides and Suburbia). Tested positive for Covid a few days later.,Phil / Gem / Rich / Chris,Y,Beauty School / Meet Me @ The Alter / Chunk No! Captain Chunk / Punk Rock Factory / Knucklepuck / The Wonder Years / The Story So Far,,04/06/2022Hatfield House,Hatfield House,2022,6,4
24/06/2022,Weezer,Fallout Boy / Greenday,Olympic Park,£80.00,Hella Mega Tour - Rivers got us backstage passes and we hung out,Sally / Rich / Stem,N,,,24/06/2022London Stadium,London Stadium,2022,6,24
15/11/2023,The Wonder Years,Mississippi / Origami Angel,O2 Shepherd's Bush Empire,£22.50,The Greatest Generation 10th Anniversary Tour,Rich / Stem,N,,,15/11/2023Shepherd's Bush Empire,Shepherd's Bush Empire,2023,11,15
18/11/2023,Symposium,A,Camden Electric Ballroom,£30.00,"Just like the old days, everyone went crazy",Meds / Rich / Stem,N,,,18/11/2023Electric Ballroom,Electric Ballroom,2023,11,18
22/05/2024,Aaron West and the Roaring Twenties,Future Teens,Underworld Camden,£30.00,,Stem / Rich,N,,,22/05/2024The Underworld,The Underworld,2024,5,22
08/06/2024,Weezer,The Smashing Pumpkins,The o2,£87.00,Hungout in Priority Lounge.  Met up with my MRN friends - Minority and Marjolaine.,Lizz / Rich / Al,N,,,08/06/2024The O2 Arena,The O2 Arena,2024,6,8
09/07/2024,Spanish Love Songs,Press Club,La Fayette,£28.00,,Stem / Rich,N,,,09/07/2024Lafayette,Lafayette,2024,7,9
24/05/2025,Slam Dunk Festival,,Hatfield House Park,£135.00,Got on the rail centre stage for The Starting Line.,Rich / Stem / Chris,Y,Sweet Pill / Hit The Lights / Sophie Powers / Kid Bookie / Knucklepuck / Winona Fighter / Heart Attack Man / Movements / The Starting Line / The Ataris / Hot Mulligan / New Found Glory / Neck Deep / Alkaline Trio,,24/05/2025Hatfield House,Hatfield House,2025,5,24
29/06/2025,Weezer,Deftones,Crystal Palace Park,£0.00,Rivers got the whole family backstage passes. Met Rivers afterwards and Gabrielle from MRN.,Sally / Clara / Eleanor / Rich / Stem / Meds / Laura,N,,,29/06/2025Crystal Palace Park,Crystal Palace Park,2025,6,29
17/01/2026,The Wonder Years,Free Throw,o2 Kentish Town Forum,£37.50,No Closer To Heaven 10th Anniversary Tour.  Trains were a mess so had to drive to East Grinstead but it was worth it.,Kate / Chris / Rich / Stem,N,,,17/01/2026Kentish Town Forum,Kentish Town Forum,2026,1,17
23/05/2026,Slam Dunk Festival,,Hatfield House Park,£131.50,,Stem / Dev / Chris,Y,,,23/05/2026Hatfield House,Hatfield House,2026,05,23
